{
  "$schema": "https://flxforge.github.io/FLXEngine/schemas/drawable.schema.json",
  "name": "AsteroidC",

  "shape": {
    "type": "polygon",
    "mode": "outline",
    "color": "orange",

    "points": [
      { "x": 0, "y": -20 },
      { "x": 8, "y": -16 },
      { "x": 20, "y": -2 },
      { "x": 12, "y": 18 },
      { "x": -4, "y": 16 },
      { "x": -18, "y": 6 },
      { "x": -16, "y": -10 }
    ]
  },

  "bounds": {
    "mode": "wrap",
    "overflow": true
  },

  "group": "asteroid",

  "collision": {
    "type": "circle",
    "active": true,
    "with": [ "ship", "asteroid", "laser" ],
    "radius": 16
  },

  "behavior": {
    "scripts": [
      "scripts/asteroid"
    ]
  },

  "spawns": {
    "small": {
      "prefab": "asteroid_small"
    },
    "fragment": {
      "prefab": "asteroid_fragment"
    }
  }
}